{
  "$schema": "https://json-schema.org/draft/2020-12/schema",
  "$id": "cenario.schema.json",
  "title": "Receita de cenário de teste (src/dados/cenarios/<id>.json)",
  "description": "Só no build de debug (?cenario=<id>; ADR-0002 §14). Desde a F-003 o cenário é uma receita de parâmetros da Vigília, não um save vigilia, que só nasce na F-008 (design/decisoes-F-003.md §5).",
  "type": "object",
  "additionalProperties": false,
  "required": [
    "id",
    "versao",
    "linha_fixa",
    "jogador",
    "diretor_desligado",
    "tutoriais_vistos",
    "rotacao",
    "armas",
    "cinzas",
    "passivas",
    "baus",
    "xp_inicial",
    "relogio_inicial_s"
  ],
  "properties": {
    "id": {
      "$ref": "comum.schema.json#/$defs/idConteudo"
    },
    "versao": {
      "type": "integer",
      "minimum": 1
    },
    "linha_fixa": {
      "description": "Linha do diretor usada para roster, mínimo, intervalo e escala, ignorando o relógio (null = segue o relógio).",
      "type": [
        "integer",
        "null"
      ],
      "minimum": 0
    },
    "jogador": {
      "type": "object",
      "additionalProperties": false,
      "required": [
        "invulneravel"
      ],
      "properties": {
        "invulneravel": {
          "description": "O contato é detectado e o timer corre, mas o HP não muda.",
          "type": "boolean"
        }
      }
    },
    "diretor_desligado": {
      "type": "boolean"
    },
    "tutoriais_vistos": {
      "type": "boolean"
    },
    "rotacao": {
      "description": "Inimigos de menor slot removidos a cada 60 passos (0 = nenhum); só para o teste de heap.",
      "type": "integer",
      "minimum": 0,
      "maximum": 500
    },
    "armas": {
      "description": "Build inicial, na ordem das vagas (design/decisoes-F-004.md §5). O teste de integridade confere que a arma existe, que o nível ≤ nivel_max e que não é União.",
      "type": "array",
      "minItems": 0,
      "maxItems": 5,
      "uniqueItems": true,
      "items": {
        "type": "object",
        "additionalProperties": false,
        "required": [
          "arma",
          "nivel"
        ],
        "properties": {
          "arma": {
            "$ref": "comum.schema.json#/$defs/idConteudo"
          },
          "nivel": {
            "type": "integer",
            "minimum": 1,
            "maximum": 8
          }
        }
      }
    },
    "cinzas": {
      "description": "false liga CENARIO.semCinzas: as mortes não soltam Cinza, sem XP nem level up (design/decisoes-F-005.md §5).",
      "type": "boolean"
    },
    "passivas": {
      "description": "Passivas iniciais, na ordem das vagas (design/decisoes-F-005.md §8).",
      "type": "array",
      "maxItems": 6,
      "uniqueItems": true,
      "items": {
        "type": "object",
        "additionalProperties": false,
        "required": [
          "passiva",
          "nivel"
        ],
        "properties": {
          "passiva": {
            "$ref": "comum.schema.json#/$defs/idConteudo"
          },
          "nivel": {
            "type": "integer",
            "minimum": 1,
            "maximum": 5
          }
        }
      }
    },
    "baus": {
      "description": "Baús no chão no início, em px relativos ao início do jogador; o índice de queda é a ordem da lista (1, 2…).",
      "type": "array",
      "maxItems": 8,
      "items": {
        "type": "object",
        "additionalProperties": false,
        "required": [
          "dx",
          "dy",
          "dourado"
        ],
        "properties": {
          "dx": {
            "type": "number",
            "minimum": -500,
            "maximum": 500
          },
          "dy": {
            "type": "number",
            "minimum": -500,
            "maximum": 500
          },
          "dourado": {
            "type": "boolean"
          }
        }
      }
    },
    "xp_inicial": {
      "description": "XP dada no início; os níveis que ela cruza abrem no passo 1 (cenário nivel_tres).",
      "type": "integer",
      "minimum": 0
    },
    "relogio_inicial_s": {
      "description": "Relógio da Vigília no início, em segundos; > 0 exige linha_fixa (a escala por minuto não salta).",
      "type": "integer",
      "minimum": 0
    },
    "ataques_inimigos": {
      "description": "true liga CENARIO.ataques: os médios telegrafam, golpeiam e lançam (design/decisoes-F-006.md VT1). Desligado por padrão e nas receitas antigas.",
      "type": "boolean"
    },
    "inimigos": {
      "description": "Inimigos postos no início, em px relativos ao início do jogador (como baus).",
      "type": "array",
      "maxItems": 64,
      "items": {
        "type": "object",
        "additionalProperties": false,
        "required": [
          "tipo",
          "dx",
          "dy"
        ],
        "properties": {
          "tipo": {
            "$ref": "comum.schema.json#/$defs/idConteudo"
          },
          "dx": {
            "type": "number",
            "minimum": -500,
            "maximum": 500
          },
          "dy": {
            "type": "number",
            "minimum": -500,
            "maximum": 500
          }
        }
      }
    },
    "stamina_inicial": {
      "description": "Stamina no início (padrão: a capacidade do Vigilante); serve para provar o teto e a negação sem esperar a regeneração.",
      "type": "number",
      "minimum": 0,
      "maximum": 100
    },
    "inicio_livre_passos": {
      "description": "Relógio inicial em passos com a linha do diretor livre (como o ?inicio): o relógio corre e os marcos de 5:00, 10:00 e 15:00 começam sozinhos (design/decisoes-F-008.md CE1). Não usa relogio_inicial_s, que exige linha_fixa.",
      "type": "integer",
      "minimum": 0
    },
    "almas_iniciais": {
      "description": "Almas no início da Vigília, fora do meta (como o ?almas).",
      "type": "integer",
      "minimum": 0,
      "maximum": 1000000
    },
    "fogueira": {
      "description": "Fogueira acesa no início, dentro do raio (design/decisoes-F-008.md CE1): a hora (1 a 3), o deslocamento horizontal em relação ao jogador, o HP em % do máximo e as cargas do Frasco.",
      "type": "object",
      "additionalProperties": false,
      "required": ["hora", "dx", "hp_pct", "frascos"],
      "properties": {
        "hora": { "type": "integer", "minimum": 1, "maximum": 3 },
        "dx": { "type": "number", "minimum": -64, "maximum": 64 },
        "hp_pct": { "type": "integer", "minimum": 1, "maximum": 100 },
        "frascos": { "type": "integer", "minimum": 0, "maximum": 3 }
      }
    }
  }
}
