{
  "id": "hora4_armas",
  "versao": 1,
  "linha_fixa": 19,
  "jogador": { "invulneravel": true },
  "diretor_desligado": false,
  "tutoriais_vistos": true,
  "rotacao": 0,
  "armas": [
    { "arma": "espada_longa_do_juramento", "nivel": 8 },
    { "arma": "facas_de_sal", "nivel": 8 },
    { "arma": "circulo_de_sal", "nivel": 8 }
  ],
  "cinzas": false,
  "passivas": [],
  "baus": [],
  "xp_inicial": 0,
  "relogio_inicial_s": 960
}
