{
  "id": "vigilia_sem_cinzas",
  "versao": 1,
  "linha_fixa": null,
  "jogador": { "invulneravel": false },
  "diretor_desligado": false,
  "tutoriais_vistos": false,
  "rotacao": 0,
  "armas": [
    { "arma": "espada_longa_do_juramento", "nivel": 1 }
  ],
  "cinzas": false,
  "passivas": [],
  "baus": [],
  "xp_inicial": 0,
  "relogio_inicial_s": 0
}
