{
  "id": "marco_coroado",
  "versao": 1,
  "linha_fixa": null,
  "jogador": { "invulneravel": true },
  "diretor_desligado": true,
  "tutoriais_vistos": true,
  "rotacao": 0,
  "armas": [{ "arma": "espada_longa_do_juramento", "nivel": 8 }],
  "cinzas": false,
  "passivas": [],
  "baus": [],
  "xp_inicial": 0,
  "relogio_inicial_s": 0,
  "ataques_inimigos": true,
  "inicio_livre_passos": 17970
}
