{
  "id": "oco_grande_sozinho",
  "versao": 1,
  "linha_fixa": null,
  "jogador": { "invulneravel": false },
  "diretor_desligado": true,
  "tutoriais_vistos": true,
  "rotacao": 0,
  "armas": [
    { "arma": "espada_longa_do_juramento", "nivel": 1 }
  ],
  "cinzas": false,
  "passivas": [],
  "baus": [],
  "xp_inicial": 0,
  "relogio_inicial_s": 0,
  "ataques_inimigos": true,
  "inimigos": [
    { "tipo": "oco_grande", "dx": 0, "dy": -160 }
  ]
}
